{
  "meta": {
    "proposal_date": "April 6, 2026",
    "proposal_number": "PROP-2026-0087",
    "version": "1.0",
    "validity_days": 30
  },
  "sender": {
    "name": "Redline Digital",
    "contact_name": "Alex Rivera",
    "contact_title": "Director of Client Solutions",
    "address": "220 West Kinzie Street, Floor 5\nChicago, IL 60654",
    "phone": "+1 312-555-0193",
    "email": "alex@redlinedigital.com",
    "website": "redlinedigital.com"
  },
  "client": {
    "name": "Summit Outdoor Gear",
    "contact_name": "Karen Huang",
    "contact_title": "VP of Marketing",
    "address": "8400 Pearl Street\nBoulder, CO 80302"
  },
  "project_name": "E-Commerce Platform Redesign & Conversion Optimization",
  "executive_summary": "Summit Outdoor Gear's current e-commerce platform is leaving revenue on the table. Site analytics show a 72% cart abandonment rate (vs. 65% industry average), mobile conversion at 0.8% (vs. 2.1% benchmark), and an average page load time of 4.2 seconds. This proposal outlines a 14-week engagement to redesign the e-commerce experience, optimize the conversion funnel, and implement performance improvements that we project will increase online revenue by 35-45% within 6 months of launch.",
  "scope": "Full redesign of the Summit Outdoor Gear e-commerce experience across desktop, tablet, and mobile breakpoints. Scope includes UX research (customer interviews, heatmap analysis, competitive audit), information architecture restructuring, UI design for all core user flows (browse, search, product detail, cart, checkout, account), front-end development of the new design on your existing Shopify Plus platform, integration with existing ERP and inventory systems, and 30 days of post-launch optimization.",
  "out_of_scope": [
    "Backend ERP or inventory management system changes",
    "Product photography or copywriting for product descriptions",
    "Email marketing template redesign",
    "Physical retail or POS system changes",
    "SEO content strategy (available as a separate engagement)"
  ],
  "approach": "We follow a research-first methodology that de-risks the design process. Week 1-3 is pure discovery: we interview 12-15 customers, analyze 90 days of behavioral data, and audit the competitive landscape. This produces a data-backed brief that drives all design decisions. Design happens in rapid 2-week sprints with stakeholder review gates between each sprint. Development runs one sprint behind design, so we maintain continuous forward progress. We launch with a 50/50 A/B test against the current site to validate performance improvements before full cutover.",
  "deliverables": [
    {
      "name": "UX Research Report",
      "description": "Customer interview synthesis, heatmap analysis, competitive audit findings, and prioritized opportunity map",
      "format": "PDF report (30-40 pages)"
    },
    {
      "name": "Information Architecture",
      "description": "Revised site map, navigation structure, category taxonomy, and search strategy",
      "format": "FigJam + PDF documentation"
    },
    {
      "name": "UI Design System",
      "description": "Complete component library with responsive design tokens, interaction patterns, and accessibility compliance (WCAG 2.1 AA)",
      "format": "Figma design system"
    },
    {
      "name": "High-Fidelity Prototypes",
      "description": "Interactive prototypes for all core user flows across desktop, tablet, and mobile",
      "format": "Figma interactive prototype"
    },
    {
      "name": "Shopify Plus Implementation",
      "description": "Production-ready front-end implementation with all integrations tested and deployed to staging",
      "format": "Shopify Plus theme + custom sections"
    },
    {
      "name": "A/B Test Results & Optimization Report",
      "description": "30-day post-launch performance analysis with conversion data, revenue impact, and optimization recommendations",
      "format": "PDF report + live dashboard"
    }
  ],
  "pricing": {
    "total": 125000,
    "total_label": "$125,000",
    "tiers": [
      {
        "name": "Essential",
        "amount": 85000,
        "amount_label": "$85,000",
        "description": "UX research, UI redesign, and Shopify Plus implementation for core user flows (browse, product, cart, checkout). Does not include post-launch optimization.",
        "recommended": false
      },
      {
        "name": "Complete",
        "amount": 125000,
        "amount_label": "$125,000",
        "description": "Full scope including research, design system, implementation, A/B testing, and 30-day post-launch optimization. Includes all 6 deliverables.",
        "recommended": true
      },
      {
        "name": "Complete + SEO",
        "amount": 155000,
        "amount_label": "$155,000",
        "description": "Everything in Complete plus SEO content strategy, technical SEO audit and implementation, and 3 months of organic search performance monitoring.",
        "recommended": false
      }
    ],
    "payment_schedule": [
      {"milestone": "Project kickoff", "percentage": "30%", "amount_label": "$37,500"},
      {"milestone": "Research complete, design sprint begins", "percentage": "25%", "amount_label": "$31,250"},
      {"milestone": "Design approved, development begins", "percentage": "25%", "amount_label": "$31,250"},
      {"milestone": "Launch + 30-day optimization complete", "percentage": "20%", "amount_label": "$25,000"}
    ]
  },
  "timeline": [
    {
      "phase": "Phase 1: Discovery & Research",
      "duration": "Weeks 1-3",
      "description": "Customer interviews, behavioral data analysis, competitive audit, opportunity mapping. Deliverable: UX Research Report."
    },
    {
      "phase": "Phase 2: Architecture & Design",
      "duration": "Weeks 4-8",
      "description": "Information architecture, design system creation, high-fidelity prototypes. Two design sprints with stakeholder review gates. Deliverables: IA documentation, design system, interactive prototypes."
    },
    {
      "phase": "Phase 3: Development & Integration",
      "duration": "Weeks 9-12",
      "description": "Shopify Plus front-end implementation, ERP/inventory integration, QA testing, staging deployment. Deliverable: Production-ready Shopify theme."
    },
    {
      "phase": "Phase 4: Launch & Optimize",
      "duration": "Weeks 13-14 + 30 days",
      "description": "50/50 A/B test launch, performance monitoring, conversion optimization, final analysis. Deliverable: A/B test results and optimization report."
    }
  ],
  "terms": [
    "This proposal is valid for 30 calendar days from the date shown above.",
    "All prices are in USD and exclusive of applicable sales tax.",
    "Payment terms: Net 15 from invoice date. Late payments subject to 1.5% monthly interest.",
    "Client will provide timely access to stakeholders, analytics platforms, and Shopify Plus admin as needed.",
    "Design revisions are included within sprint review cycles. Additional revision rounds beyond the agreed sprint structure are billed at $250/hour.",
    "Redline Digital retains the right to feature this project in our portfolio with client approval.",
    "Either party may terminate with 14 days written notice. Client is responsible for payment of all work completed through the termination date.",
    "All deliverables become client property upon full payment."
  ],
  "signature": {
    "sender_name": "Alex Rivera",
    "sender_title": "Director of Client Solutions, Redline Digital",
    "client_name": "Karen Huang",
    "client_title": "VP of Marketing, Summit Outdoor Gear"
  },
  "team": [
    {
      "name": "Alex Rivera",
      "role": "Project Lead & Client Partner",
      "bio": "12 years in digital strategy. Led e-commerce redesigns for REI, Patagonia, and North Face generating $40M+ in incremental revenue."
    },
    {
      "name": "Priya Nair",
      "role": "Lead UX Researcher",
      "bio": "Former UX researcher at Google and Shopify. Specializes in e-commerce conversion optimization."
    },
    {
      "name": "James Park",
      "role": "Senior UI Designer",
      "bio": "Award-winning designer with expertise in outdoor lifestyle brands and accessible design systems."
    },
    {
      "name": "Maya Chen",
      "role": "Lead Shopify Plus Developer",
      "bio": "Shopify Plus certified expert. 50+ store builds including 3 Shopify Commerce Awards finalists."
    }
  ],
  "why_us": [
    "Deep e-commerce specialization: 80% of our revenue comes from e-commerce redesign and optimization engagements",
    "Outdoor industry experience: portfolio includes REI, Patagonia, North Face, Osprey, and Black Diamond",
    "Data-driven process: every design decision traced back to research findings, not opinions",
    "Shopify Plus certified partner with 50+ production store builds",
    "Performance guarantee: we commit to measurable conversion improvement or extend optimization at no cost"
  ]
}
